{
  "$schema": "../schema/evidence-record.schema.json",
  "schema_version": "0.1.0",
  "evidence_id": "EVD-ENG3-API100-GATEWAY",
  "title": "Fictional API-100 gateway configuration and routing package for Summit Analytics CAP-140",
  "description": "A fictional gateway routing configuration export and allowlist package used in the third workbook engagement vignette to support examination of API-100.",
  "evidence_type": "configuration",
  "source": {
    "identity": "Fictional Summit Analytics AI gateway control plane",
    "locator": "example://summit/gateway/config/cap-140-2026-09"
  },
  "custodian": {
    "name": "Jordan Hale",
    "role": "AI platform engineer",
    "organization": "Fictional Summit Analytics"
  },
  "collected_at": "2026-09-15T10:00:00Z",
  "collection_method": "Read-only export of the fictional effective gateway routing, allowlist, and identity-propagation settings for CAP-140.",
  "scope": {
    "description": "Fictional production AI gateway configuration enforcing CAP-140 model and provider routing during the engagement period."
  },
  "period": {
    "start": "2026-09-01T00:00:00Z",
    "end": "2026-09-15T23:59:59Z"
  },
  "population": {
    "description": "One fictional effective gateway configuration revision for CAP-140.",
    "sample": "Complete fictional routing and allowlist package for revision 42.",
    "selection_rationale": "API-100 examination focuses on the authoritative gateway configuration for the named capability."
  },
  "quality": {
    "relevance": {
      "rating": "adequate",
      "rationale": "The configuration addresses the fictional API-100 routing and policy-enforcement obligations under examination."
    },
    "reliability": {
      "rating": "limited",
      "rationale": "The example does not independently verify the gateway control plane."
    },
    "completeness": {
      "rating": "adequate",
      "rationale": "The package includes routing, allowlist, and identity-propagation settings."
    },
    "timeliness": {
      "rating": "adequate",
      "rationale": "Revision 42 was effective throughout the fictional assessment period."
    },
    "attribution": {
      "rating": "adequate",
      "rationale": "Platform owner and change approvers are identified."
    },
    "integrity": {
      "rating": "limited",
      "rationale": "The fictional digest illustrates verification without asserting real assurance."
    },
    "traceability": {
      "rating": "adequate",
      "rationale": "The example links to the fictional assessment result and API-100 procedure."
    },
    "sufficiency": "limited",
    "evaluated_by": {
      "name": "Morgan Ellis",
      "role": "Independent assessor",
      "organization": "Fictional Contour Assurance LLP"
    },
    "evaluated_at": "2026-09-15T11:00:00Z",
    "sufficiency_rationale": "The fictional gateway configuration is limited evidence for API-100 and requires corroborating Test evidence in a real engagement."
  },
  "integrity": {
    "digest_algorithm": "sha-256",
    "digest": "4444444444444444444444444444444444444444444444444444444444444444"
  },
  "limitations": [
    "This fictional workbook example does not demonstrate an actual organization's gateway control.",
    "Configuration export alone does not prove runtime enforcement against bypass attempts."
  ],
  "retention": {
    "authority": "Fictional Summit Analytics records schedule",
    "end_condition": "Retain until the fictional assessment archive period ends."
  },
  "traceability": {
    "requirement_refs": [
      "API-100"
    ],
    "procedure_refs": [
      "API-100-A1"
    ],
    "result_refs": [
      "ASR-ENG3-API100"
    ]
  },
  "example_notice": "Fictional non-authoritative example; no organization, ESAF control, profile, or external framework has been assessed."
}
